{
  "cost": {
    "agents": 0,
    "completion_tokens": 0,
    "prompt_tokens": 0,
    "usd": 0.0,
    "wall_s": 0.0
  },
  "deterministic": true,
  "inputs_sha": {
    "answerability": "db89f488ed9938055eff7defb26e42350ae2e2bcce500dc2bcf12303fbe0adad",
    "canon": "da786d73407b96d1d9c857ce51ebb5ef34efafb135ea7602cf017929054d1ba5",
    "demand": "7169785059bc9ceaf313025f6efef9bf7724b815ac57a79833203b9abd0e12e8",
    "map": "32607587028474caf015e63024f6f31d8a07a166354d31dac4408b725756e669"
  },
  "payload": {
    "cells": [
      {
        "all_verdicts_agree": true,
        "audience": "prospect",
        "cause_state": "UNSTABLE['S', 'S_OK']",
        "cell_id": "C01",
        "coverage": "已覆蓋",
        "disposition": "fine",
        "draft_path": null,
        "entry_state": "ask_back",
        "fine_id": "prospect/A/product-overview",
        "fix_type": "add_knowledge",
        "gap_classes": [
          "retrieval_gap"
        ],
        "judge_agreement": 1.0,
        "judge_label": "partial",
        "min_verification": {
          "expected_fine_id": "prospect/A/product-overview",
          "phrasings": [
            "你們系統適合我嗎",
            "想了解你們產品",
            "你們這個怎麼用",
            "系統有哪些功能"
          ]
        },
        "topic": "系統適不適合我／想了解產品"
      },
      {
        "all_verdicts_agree": true,
        "audience": "prospect",
        "cause_state": "UNSTABLE['S', 'S_OK']",
        "cell_id": "C02",
        "coverage": "未覆蓋",
        "disposition": "fine",
        "draft_path": null,
        "entry_state": "fixed",
        "fine_id": "prospect/C/overdue-reminder-late-fee",
        "fix_type": "add_phrasing",
        "gap_classes": [
          "retrieval_gap"
        ],
        "judge_agreement": 1.0,
        "judge_label": "answerable",
        "min_verification": {
          "expected_fine_id": "prospect/C/overdue-reminder-late-fee",
          "phrasings": [
            "收租常常忘記，你們適合我嗎",
            "你們能解決什麼問題"
          ]
        },
        "topic": "你們能解決什麼問題／痛點"
      },
      {
        "all_verdicts_agree": true,
        "audience": "prospect",
        "cause_state": "S_OK",
        "cell_id": "C03",
        "coverage": "已覆蓋",
        "disposition": "fine",
        "draft_path": null,
        "entry_state": "answered_handoff",
        "fine_id": "prospect/C/contract-templates",
        "fix_type": "add_knowledge",
        "gap_classes": [],
        "judge_agreement": 1.0,
        "judge_label": "partial",
        "min_verification": {
          "expected_fine_id": "prospect/C/contract-templates",
          "phrasings": [
            "包租跟代管在系統上有什麼差別"
          ]
        },
        "topic": "包租 vs 代管在系統上的差別"
      },
      {
        "all_verdicts_agree": true,
        "audience": "prospect",
        "cause_state": "S_OK",
        "cell_id": "C04",
        "coverage": "已覆蓋",
        "disposition": "fine",
        "draft_path": null,
        "entry_state": "answered",
        "fine_id": "prospect/C/what-is-owner-landlord",
        "fix_type": null,
        "gap_classes": [],
        "judge_agreement": 1.0,
        "judge_label": "answerable",
        "min_verification": {
          "expected_fine_id": "prospect/C/what-is-owner-landlord",
          "phrasings": [
            "大房東模式是什麼意思"
          ]
        },
        "topic": "大房東模式是什麼"
      },
      {
        "all_verdicts_agree": true,
        "audience": "prospect",
        "cause_state": "S_OK",
        "cell_id": "C05",
        "coverage": "已覆蓋",
        "disposition": "fine",
        "draft_path": null,
        "entry_state": "answered_handoff",
        "fine_id": "prospect/D/pricing-plans",
        "fix_type": "add_knowledge",
        "gap_classes": [],
        "judge_agreement": 1.0,
        "judge_label": "partial",
        "min_verification": {
          "expected_fine_id": "prospect/D/pricing-plans",
          "phrasings": [
            "你們怎麼收費 多少錢",
            "費用怎麼算",
            "一年費用怎麼算？180間房大概多少錢"
          ]
        },
        "topic": "怎麼收費／多少錢"
      },
      {
        "all_verdicts_agree": true,
        "audience": "prospect",
        "cause_state": "S_OK",
        "cell_id": "C06",
        "coverage": "已覆蓋",
        "disposition": "fine",
        "draft_path": null,
        "entry_state": "answered_handoff",
        "fine_id": "prospect/D/pricing-plans",
        "fix_type": "add_knowledge",
        "gap_classes": [],
        "judge_agreement": 1.0,
        "judge_label": "partial",
        "min_verification": {
          "expected_fine_id": "prospect/D/pricing-plans",
          "phrasings": [
            "目前有幾種訂閱方案，差別在哪裡呢？"
          ]
        },
        "topic": "訂閱方案幾種／差在哪"
      },
      {
        "all_verdicts_agree": true,
        "audience": "prospect",
        "cause_state": "FALSE_HIT",
        "cell_id": "C07",
        "coverage": "未覆蓋",
        "disposition": "owner_decision",
        "draft_path": null,
        "entry_state": "answered_handoff",
        "fine_id": null,
        "fix_type": "add_knowledge",
        "gap_classes": [],
        "judge_agreement": 1.0,
        "judge_label": "no_source",
        "min_verification": {
          "expected_fine_id": null,
          "phrasings": [
            "免費方案可以建幾個物件"
          ]
        },
        "topic": "免費方案可建幾個物件"
      },
      {
        "all_verdicts_agree": true,
        "audience": "prospect",
        "cause_state": "V",
        "cell_id": "C08",
        "coverage": "未覆蓋",
        "disposition": "fine",
        "draft_path": null,
        "entry_state": "fixed",
        "fine_id": "prospect/D/subscription-change-renewal",
        "fix_type": "add_phrasing",
        "gap_classes": [
          "retrieval_gap"
        ],
        "judge_agreement": 1.0,
        "judge_label": "answerable",
        "min_verification": {
          "expected_fine_id": "prospect/D/subscription-change-renewal",
          "phrasings": [
            "怎麼升級訂閱方案",
            "訂閱到期會自動續嗎"
          ]
        },
        "topic": "升級方案／到期自動續約"
      },
      {
        "all_verdicts_agree": true,
        "audience": "prospect",
        "cause_state": "S_OK",
        "cell_id": "C09",
        "coverage": "已覆蓋",
        "disposition": "fine",
        "draft_path": null,
        "entry_state": "answered_handoff",
        "fine_id": "prospect/D/free-trial",
        "fix_type": null,
        "gap_classes": [],
        "judge_agreement": 1.0,
        "judge_label": "answerable",
        "min_verification": {
          "expected_fine_id": "prospect/D/free-trial",
          "phrasings": [
            "可以免費試用嗎"
          ]
        },
        "topic": "免費試用"
      },
      {
        "all_verdicts_agree": true,
        "audience": "prospect",
        "cause_state": "DELIBERATE_NO",
        "cell_id": "C10",
        "coverage": "符合(刻意不補)",
        "disposition": "deliberate_no",
        "draft_path": null,
        "entry_state": "fixed",
        "fine_id": null,
        "fix_type": null,
        "gap_classes": [],
        "judge_agreement": 1.0,
        "judge_label": "deliberate_no",
        "min_verification": {
          "expected_fine_id": null,
          "phrasings": [
            "可以客製開發嗎？怎麼計價"
          ]
        },
        "topic": "客製開發／怎麼計價"
      },
      {
        "all_verdicts_agree": true,
        "audience": "prospect",
        "cause_state": "S_OK",
        "cell_id": "C11",
        "coverage": "已覆蓋",
        "disposition": "fine",
        "draft_path": null,
        "entry_state": "answered",
        "fine_id": "prospect/C/community-batch-create",
        "fix_type": null,
        "gap_classes": [],
        "judge_agreement": 1.0,
        "judge_label": "answerable",
        "min_verification": {
          "expected_fine_id": "prospect/C/community-batch-create",
          "phrasings": [
            "物件可以批次上傳嗎",
            "如何新增物件"
          ]
        },
        "topic": "新增物件／批次上傳"
      },
      {
        "all_verdicts_agree": true,
        "audience": "prospect",
        "cause_state": "V",
        "cell_id": "C12",
        "coverage": "未覆蓋",
        "disposition": "fine",
        "draft_path": null,
        "entry_state": "fixed",
        "fine_id": "prospect/C/property-status-meaning",
        "fix_type": "add_phrasing",
        "gap_classes": [
          "retrieval_gap"
        ],
        "judge_agreement": 1.0,
        "judge_label": "answerable",
        "min_verification": {
          "expected_fine_id": "prospect/C/property-status-meaning",
          "phrasings": [
            "物件狀態「未刊登」「刊登中」「洽談中」「租約中」分別是什麼"
          ]
        },
        "topic": "物件狀態四態是什麼"
      },
      {
        "all_verdicts_agree": true,
        "audience": "prospect",
        "cause_state": "N_CAND",
        "cell_id": "C13",
        "coverage": "未覆蓋",
        "disposition": "fine",
        "draft_path": null,
        "entry_state": "fixed",
        "fine_id": "prospect/C/community-batch-create",
        "fix_type": "add_knowledge",
        "gap_classes": [],
        "judge_agreement": 1.0,
        "judge_label": "partial",
        "min_verification": {
          "expected_fine_id": "prospect/C/community-batch-create",
          "phrasings": [
            "建立社區的流程是什麼樣的？",
            "社區的公開頁面是用來幹嘛的？"
          ]
        },
        "topic": "社區建立與公開頁面"
      },
      {
        "all_verdicts_agree": true,
        "audience": "prospect",
        "cause_state": "UNSTABLE['S', 'S_OK']",
        "cell_id": "C14",
        "coverage": "未覆蓋",
        "disposition": "fine",
        "draft_path": null,
        "entry_state": "fixed",
        "fine_id": "prospect/C/rental-storefront-vr",
        "fix_type": "add_phrasing",
        "gap_classes": [
          "retrieval_gap"
        ],
        "judge_agreement": 1.0,
        "judge_label": "answerable",
        "min_verification": {
          "expected_fine_id": "prospect/C/rental-storefront-vr",
          "phrasings": [
            "什麼是房東對外首頁",
            "如何設置 VR 虛擬導覽呢？"
          ]
        },
        "topic": "招租店舖／對外首頁／VR 看屋"
      },
      {